joburl,jobid,title,company,companyurl,companylogo,location,salary,applicantscount,postedat,worktype,seniority,jobfunction,companyindustry,collectedat,searchquery,searchlocation,searchtimerange,descriptionhtml,descriptiontext,url,description_text,description,description_html,employment_type,date_posted,workplace_type,source,id,is_relevant,tech_stack,min_years_exp,salary_min,salary_max,reason,category,salary_currency,salary_unit,hiring_remote_in,salary_range_short,company_overview,posteddate,description_snippet,similarity_score
https://www.linkedin.com/jobs-guest/jobs/api/jobPosting/4410558384,4410558384.0,Senior Solutions Engineer,Tiro Partners Limited,https://uk.linkedin.com/company/tiro-partners-ltd?trk=public_jobs_topcard-org-name,https://media.licdn.com/dms/image/v2/D4E0BAQF89uh-Toflxw/company-logo_100_100/company-logo_100_100/0/1663239100036/tiro_partners_ltd_logo?e=2147483647&v=beta&t=eCO14e-5XusoDDbzvWLuZ5d5SQl675XXU60UzEAO0Ac,"London Area, United Kingdom","£90,000.00/yr - £120,000.00/yr",,2 days ago,Full-time,Senior,Information Technology,"Technology, Information and Media",2026-05-08T07:44:03.101Z,solutions engineer,Europe,30d,"
          <p>Solutions Engineer / AI / Agentic / Financial Services / FinTech / Forward Deployed / Pre-sales</p><p><br></p><p>Senior Solutions Engineer</p><p>Company: Agentic AI x Financial Services</p><p>London (Hybrid)</p><p>Salary: &#xa3;90k&#x2013;&#xa3;120k + Equity</p><p><br></p><p>We&#x2019;re working with a cutting-edge AI company building next-gen agentic systems set to transform financial services. They&#x2019;re hiring a Founding Solutions Engineer to bridge product, engineering, and customers owning the full journey from problem to deployed solution.</p><p><br></p><p><strong>What you&#x2019;ll do:</strong></p><p>&#x2022; Work directly with customers to understand complex problems and design scalable AI solutions</p><p>&#x2022; Architect and deliver end-to-end implementations (from discovery &#x2192; deployment &#x2192; iteration)</p><p>&#x2022; Lead demos, PoCs, and production rollouts</p><p>&#x2022; Act as a trusted technical advisor across pre- &amp; post-sales</p><p>&#x2022; Stay hands-on with Python, APIs, and integrations</p><p>&#x2022; Partner closely with engineering &amp; product to shape what gets built</p><p><br></p><p><strong>What they&#x2019;re looking for:</strong></p><p>&#x2022; Solutions Engineer / Technical Consultant / Forward Deployed Engineer background</p><p>&#x2022; Strong Python + API/integration experience</p><p>&#x2022; Proven track record delivering real-world technical solutions</p><p>&#x2022; Ability to translate business needs into technical architecture</p><p>&#x2022; Interest in AI/LLMs (agentic systems a big plus)</p><p>&#x2022; Experience in financial services</p><p><br></p><p><strong>Why join?</strong></p><p>&#x2022; True founding-level role with high ownership</p><p>&#x2022; Build AI solving mission-critical workflows in finance</p><p>&#x2022; Strong salary + meaningful equity</p><p>&#x2022; Massive scope to shape product + customer impact</p><p><br></p><p>Solutions Engineer / AI / Agentic / Financial Services / FinTech / Forward Deployed / Pre-sales</p>
        ","Solutions Engineer / AI / Agentic / Financial Services / FinTech / Forward Deployed / Pre-salesSenior Solutions EngineerCompany: Agentic AI x Financial ServicesLondon (Hybrid)Salary: £90k–£120k + EquityWe’re working with a cutting-edge AI company building next-gen agentic systems set to transform financial services. They’re hiring a Founding Solutions Engineer to bridge product, engineering, and customers owning the full journey from problem to deployed solution.What you’ll do:• Work directly with customers to understand complex problems and design scalable AI solutions• Architect and deliver end-to-end implementations (from discovery → deployment → iteration)• Lead demos, PoCs, and production rollouts• Act as a trusted technical advisor across pre- & post-sales• Stay hands-on with Python, APIs, and integrations• Partner closely with engineering & product to shape what gets builtWhat they’re looking for:• Solutions Engineer / Technical Consultant / Forward Deployed Engineer background• Strong Python + API/integration experience• Proven track record delivering real-world technical solutions• Ability to translate business needs into technical architecture• Interest in AI/LLMs (agentic systems a big plus)• Experience in financial servicesWhy join?• True founding-level role with high ownership• Build AI solving mission-critical workflows in finance• Strong salary + meaningful equity• Massive scope to shape product + customer impactSolutions Engineer / AI / Agentic / Financial Services / FinTech / Forward Deployed / Pre-sales",https://www.linkedin.com/jobs-guest/jobs/api/jobPosting/4410558384,"Solutions Engineer / AI / Agentic / Financial Services / FinTech / Forward Deployed / Pre-salesSenior Solutions EngineerCompany: Agentic AI x Financial ServicesLondon (Hybrid)Salary: £90k–£120k + EquityWe’re working with a cutting-edge AI company building next-gen agentic systems set to transform financial services. They’re hiring a Founding Solutions Engineer to bridge product, engineering, and customers owning the full journey from problem to deployed solution.What you’ll do:• Work directly with customers to understand complex problems and design scalable AI solutions• Architect and deliver end-to-end implementations (from discovery → deployment → iteration)• Lead demos, PoCs, and production rollouts• Act as a trusted technical advisor across pre- & post-sales• Stay hands-on with Python, APIs, and integrations• Partner closely with engineering & product to shape what gets builtWhat they’re looking for:• Solutions Engineer / Technical Consultant / Forward Deployed Engineer background• Strong Python + API/integration experience• Proven track record delivering real-world technical solutions• Ability to translate business needs into technical architecture• Interest in AI/LLMs (agentic systems a big plus)• Experience in financial servicesWhy join?• True founding-level role with high ownership• Build AI solving mission-critical workflows in finance• Strong salary + meaningful equity• Massive scope to shape product + customer impactSolutions Engineer / AI / Agentic / Financial Services / FinTech / Forward Deployed / Pre-sales","Solutions Engineer / AI / Agentic / Financial Services / FinTech / Forward Deployed / Pre-salesSenior Solutions EngineerCompany: Agentic AI x Financial ServicesLondon (Hybrid)Salary: £90k–£120k + EquityWe’re working with a cutting-edge AI company building next-gen agentic systems set to transform financial services. They’re hiring a Founding Solutions Engineer to bridge product, engineering, and customers owning the full journey from problem to deployed solution.What you’ll do:• Work directly with customers to understand complex problems and design scalable AI solutions• Architect and deliver end-to-end implementations (from discovery → deployment → iteration)• Lead demos, PoCs, and production rollouts• Act as a trusted technical advisor across pre- & post-sales• Stay hands-on with Python, APIs, and integrations• Partner closely with engineering & product to shape what gets builtWhat they’re looking for:• Solutions Engineer / Technical Consultant / Forward Deployed Engineer background• Strong Python + API/integration experience• Proven track record delivering real-world technical solutions• Ability to translate business needs into technical architecture• Interest in AI/LLMs (agentic systems a big plus)• Experience in financial servicesWhy join?• True founding-level role with high ownership• Build AI solving mission-critical workflows in finance• Strong salary + meaningful equity• Massive scope to shape product + customer impactSolutions Engineer / AI / Agentic / Financial Services / FinTech / Forward Deployed / Pre-sales","
          <p>Solutions Engineer / AI / Agentic / Financial Services / FinTech / Forward Deployed / Pre-sales</p><p><br></p><p>Senior Solutions Engineer</p><p>Company: Agentic AI x Financial Services</p><p>London (Hybrid)</p><p>Salary: &#xa3;90k&#x2013;&#xa3;120k + Equity</p><p><br></p><p>We&#x2019;re working with a cutting-edge AI company building next-gen agentic systems set to transform financial services. They&#x2019;re hiring a Founding Solutions Engineer to bridge product, engineering, and customers owning the full journey from problem to deployed solution.</p><p><br></p><p><strong>What you&#x2019;ll do:</strong></p><p>&#x2022; Work directly with customers to understand complex problems and design scalable AI solutions</p><p>&#x2022; Architect and deliver end-to-end implementations (from discovery &#x2192; deployment &#x2192; iteration)</p><p>&#x2022; Lead demos, PoCs, and production rollouts</p><p>&#x2022; Act as a trusted technical advisor across pre- &amp; post-sales</p><p>&#x2022; Stay hands-on with Python, APIs, and integrations</p><p>&#x2022; Partner closely with engineering &amp; product to shape what gets built</p><p><br></p><p><strong>What they&#x2019;re looking for:</strong></p><p>&#x2022; Solutions Engineer / Technical Consultant / Forward Deployed Engineer background</p><p>&#x2022; Strong Python + API/integration experience</p><p>&#x2022; Proven track record delivering real-world technical solutions</p><p>&#x2022; Ability to translate business needs into technical architecture</p><p>&#x2022; Interest in AI/LLMs (agentic systems a big plus)</p><p>&#x2022; Experience in financial services</p><p><br></p><p><strong>Why join?</strong></p><p>&#x2022; True founding-level role with high ownership</p><p>&#x2022; Build AI solving mission-critical workflows in finance</p><p>&#x2022; Strong salary + meaningful equity</p><p>&#x2022; Massive scope to shape product + customer impact</p><p><br></p><p>Solutions Engineer / AI / Agentic / Financial Services / FinTech / Forward Deployed / Pre-sales</p>
        ",Full-time,2 days ago,Full-time,linkedin,19,True,"[""Python""]",5,90000.0,120000.0,"The role involves solving client issues in a pre-sales capacity, relevant to enterprise sales.",,,,,,,,,0.6081632061617293
